2025-10-08T18:45:47+00:00 LEAD#00 I: Runner: processes
2025-10-08T18:45:47+00:00 LEAD#00 I: Chooser: simple
2025-10-08T18:45:47+00:00 LEAD#00 I: Configuration suite_name = "minesweeper tests"
2025-10-08T18:45:47+00:00 LEAD#00 I: Configuration cache_filename = "/home/tobi/FPSE/FPSE-FALL-2025/minesweeper/_build/oUnit-$(suite_name).cache"
2025-10-08T18:45:47+00:00 LEAD#00 I: Configuration run_gc_full_major = "true"
2025-10-08T18:45:47+00:00 LEAD#00 I: Configuration display = "true"
2025-10-08T18:45:47+00:00 LEAD#00 I: Configuration results_style_1_X = "false"
2025-10-08T18:45:47+00:00 LEAD#00 I: Configuration testdata_dir = "none"
2025-10-08T18:45:47+00:00 LEAD#00 I: Configuration health_check_interval = "1."
2025-10-08T18:45:47+00:00 LEAD#00 I: Configuration verbose = "false"
2025-10-08T18:45:47+00:00 LEAD#00 I: Configuration chooser = "simple"
2025-10-08T18:45:47+00:00 LEAD#00 I: Configuration output_html_dir = "none"
2025-10-08T18:45:47+00:00 LEAD#00 I: Configuration processes_kill_period = "5."
2025-10-08T18:45:47+00:00 LEAD#00 I: Configuration runner = "processes"
2025-10-08T18:45:47+00:00 LEAD#00 I: Configuration shards = "8"
2025-10-08T18:45:47+00:00 LEAD#00 I: Configuration processes_grace_period = "5."
2025-10-08T18:45:47+00:00 LEAD#00 I: Configuration log_encoding = "utf-8"
2025-10-08T18:45:47+00:00 LEAD#00 I: Configuration output_junit_file = "none"
2025-10-08T18:45:47+00:00 LEAD#00 I: Configuration ci = "false"
2025-10-08T18:45:47+00:00 LEAD#00 I: Configuration output_file = "/home/tobi/FPSE/FPSE-FALL-2025/minesweeper/_build/oUnit-$(suite_name)-$(shard_id).log"
2025-10-08T18:45:47+00:00 LEAD#00 I: Using 8 workers maximum.
2025-10-08T18:45:47+00:00 LEAD#00 I: Starting worker number LEAD#01.
2025-10-08T18:45:47+00:00 LEAD#00 I: Worker LEAD#01 started.
2025-10-08T18:45:47+00:00 LEAD#00 I: Starting worker number LEAD#02.
2025-10-08T18:45:47+00:00 LEAD#00 I: Worker LEAD#02 started.
2025-10-08T18:45:47+00:00 LEAD#00 I: Starting worker number LEAD#03.
2025-10-08T18:45:47+00:00 LEAD#00 I: Worker LEAD#03 started.
2025-10-08T18:45:47+00:00 LEAD#00 I: Starting worker number LEAD#04.
2025-10-08T18:45:47+00:00 LEAD#00 I: Worker LEAD#04 started.
2025-10-08T18:45:47+00:00 LEAD#00 I: Starting worker number LEAD#05.
2025-10-08T18:45:47+00:00 LEAD#00 I: Worker LEAD#05 started.
2025-10-08T18:45:47+00:00 LEAD#00 I: Starting worker number LEAD#06.
2025-10-08T18:45:47+00:00 LEAD#00 I: Worker LEAD#06 started.
2025-10-08T18:45:47+00:00 LEAD#00 I: Starting worker number LEAD#07.
2025-10-08T18:45:47+00:00 LEAD#00 I: Worker LEAD#07 started.
2025-10-08T18:45:47+00:00 LEAD#00 I: Starting worker number LEAD#08.
2025-10-08T18:45:47+00:00 LEAD#00 I: Worker LEAD#08 started.
2025-10-08T18:45:47+00:00 LEAD#00 I: 8 tests running: minesweeper tests:7:horizontal line, mines at edges, minesweeper tests:6:horizontal line, minesweeper tests:5:space surrounded by mines, minesweeper tests:4:mine surrounded by spaces, minesweeper tests:3:minefield with only mines, minesweeper tests:2:no mines, minesweeper tests:1:no columns, minesweeper tests:0:no rows.
2025-10-08T18:45:47+00:00 LEAD#01 I: Start test minesweeper tests:0:no rows.
2025-10-08T18:45:47+00:00 LEAD#02 I: Start test minesweeper tests:1:no columns.
2025-10-08T18:45:47+00:00 LEAD#03 I: Start test minesweeper tests:2:no mines.
2025-10-08T18:45:47+00:00 LEAD#04 I: Start test minesweeper tests:3:minefield with only mines.
2025-10-08T18:45:47+00:00 LEAD#05 I: Start test minesweeper tests:4:mine surrounded by spaces.
2025-10-08T18:45:47+00:00 LEAD#06 I: Start test minesweeper tests:5:space surrounded by mines.
2025-10-08T18:45:47+00:00 LEAD#07 I: Start test minesweeper tests:6:horizontal line.
2025-10-08T18:45:47+00:00 LEAD#00 I: 8 tests running: minesweeper tests:7:horizontal line, mines at edges, minesweeper tests:6:horizontal line, minesweeper tests:5:space surrounded by mines, minesweeper tests:4:mine surrounded by spaces, minesweeper tests:3:minefield with only mines, minesweeper tests:2:no mines, minesweeper tests:1:no columns, minesweeper tests:0:no rows.
2025-10-08T18:45:47+00:00 LEAD#08 I: Start test minesweeper tests:7:horizontal line, mines at edges.
2025-10-08T18:45:47+00:00 LEAD#00 I: 8 tests running: minesweeper tests:7:horizontal line, mines at edges, minesweeper tests:6:horizontal line, minesweeper tests:5:space surrounded by mines, minesweeper tests:4:mine surrounded by spaces, minesweeper tests:3:minefield with only mines, minesweeper tests:2:no mines, minesweeper tests:1:no columns, minesweeper tests:0:no rows.
2025-10-08T18:45:47+00:00 LEAD#02 I: Test minesweeper tests:1:no columns is successful.
2025-10-08T18:45:47+00:00 LEAD#00 I: 8 tests running: minesweeper tests:7:horizontal line, mines at edges, minesweeper tests:6:horizontal line, minesweeper tests:5:space surrounded by mines, minesweeper tests:4:mine surrounded by spaces, minesweeper tests:3:minefield with only mines, minesweeper tests:2:no mines, minesweeper tests:1:no columns, minesweeper tests:0:no rows.
2025-10-08T18:45:47+00:00 LEAD#02 I: End test minesweeper tests:1:no columns.
2025-10-08T18:45:47+00:00 LEAD#00 I: 8 tests running: minesweeper tests:7:horizontal line, mines at edges, minesweeper tests:6:horizontal line, minesweeper tests:5:space surrounded by mines, minesweeper tests:4:mine surrounded by spaces, minesweeper tests:3:minefield with only mines, minesweeper tests:2:no mines, minesweeper tests:1:no columns, minesweeper tests:0:no rows.
2025-10-08T18:45:47+00:00 LEAD#00 I: 8 tests running: minesweeper tests:8:vertical line, minesweeper tests:7:horizontal line, mines at edges, minesweeper tests:6:horizontal line, minesweeper tests:5:space surrounded by mines, minesweeper tests:4:mine surrounded by spaces, minesweeper tests:3:minefield with only mines, minesweeper tests:2:no mines, minesweeper tests:0:no rows.
2025-10-08T18:45:47+00:00 LEAD#02 I: Start test minesweeper tests:8:vertical line.
2025-10-08T18:45:47+00:00 LEAD#00 I: 8 tests running: minesweeper tests:8:vertical line, minesweeper tests:7:horizontal line, mines at edges, minesweeper tests:6:horizontal line, minesweeper tests:5:space surrounded by mines, minesweeper tests:4:mine surrounded by spaces, minesweeper tests:3:minefield with only mines, minesweeper tests:2:no mines, minesweeper tests:0:no rows.
2025-10-08T18:45:47+00:00 LEAD#01 I: Test minesweeper tests:0:no rows is successful.
2025-10-08T18:45:47+00:00 LEAD#00 I: 8 tests running: minesweeper tests:8:vertical line, minesweeper tests:7:horizontal line, mines at edges, minesweeper tests:6:horizontal line, minesweeper tests:5:space surrounded by mines, minesweeper tests:4:mine surrounded by spaces, minesweeper tests:3:minefield with only mines, minesweeper tests:2:no mines, minesweeper tests:0:no rows.
2025-10-08T18:45:47+00:00 LEAD#01 I: End test minesweeper tests:0:no rows.
2025-10-08T18:45:47+00:00 LEAD#00 I: 8 tests running: minesweeper tests:8:vertical line, minesweeper tests:7:horizontal line, mines at edges, minesweeper tests:6:horizontal line, minesweeper tests:5:space surrounded by mines, minesweeper tests:4:mine surrounded by spaces, minesweeper tests:3:minefield with only mines, minesweeper tests:2:no mines, minesweeper tests:0:no rows.
2025-10-08T18:45:47+00:00 LEAD#00 I: 8 tests running: minesweeper tests:9:vertical line, mines at edges, minesweeper tests:8:vertical line, minesweeper tests:7:horizontal line, mines at edges, minesweeper tests:6:horizontal line, minesweeper tests:5:space surrounded by mines, minesweeper tests:4:mine surrounded by spaces, minesweeper tests:3:minefield with only mines, minesweeper tests:2:no mines.
2025-10-08T18:45:47+00:00 LEAD#01 I: Start test minesweeper tests:9:vertical line, mines at edges.
2025-10-08T18:45:47+00:00 LEAD#00 I: 8 tests running: minesweeper tests:9:vertical line, mines at edges, minesweeper tests:8:vertical line, minesweeper tests:7:horizontal line, mines at edges, minesweeper tests:6:horizontal line, minesweeper tests:5:space surrounded by mines, minesweeper tests:4:mine surrounded by spaces, minesweeper tests:3:minefield with only mines, minesweeper tests:2:no mines.
2025-10-08T18:45:47+00:00 LEAD#02 I: Test minesweeper tests:8:vertical line is successful.
2025-10-08T18:45:47+00:00 LEAD#00 I: 8 tests running: minesweeper tests:9:vertical line, mines at edges, minesweeper tests:8:vertical line, minesweeper tests:7:horizontal line, mines at edges, minesweeper tests:6:horizontal line, minesweeper tests:5:space surrounded by mines, minesweeper tests:4:mine surrounded by spaces, minesweeper tests:3:minefield with only mines, minesweeper tests:2:no mines.
2025-10-08T18:45:47+00:00 LEAD#02 I: End test minesweeper tests:8:vertical line.
2025-10-08T18:45:47+00:00 LEAD#00 I: 8 tests running: minesweeper tests:9:vertical line, mines at edges, minesweeper tests:8:vertical line, minesweeper tests:7:horizontal line, mines at edges, minesweeper tests:6:horizontal line, minesweeper tests:5:space surrounded by mines, minesweeper tests:4:mine surrounded by spaces, minesweeper tests:3:minefield with only mines, minesweeper tests:2:no mines.
2025-10-08T18:45:47+00:00 LEAD#00 I: 8 tests running: minesweeper tests:10:cross, minesweeper tests:9:vertical line, mines at edges, minesweeper tests:7:horizontal line, mines at edges, minesweeper tests:6:horizontal line, minesweeper tests:5:space surrounded by mines, minesweeper tests:4:mine surrounded by spaces, minesweeper tests:3:minefield with only mines, minesweeper tests:2:no mines.
2025-10-08T18:45:47+00:00 LEAD#02 I: Start test minesweeper tests:10:cross.
2025-10-08T18:45:47+00:00 LEAD#00 I: 8 tests running: minesweeper tests:10:cross, minesweeper tests:9:vertical line, mines at edges, minesweeper tests:7:horizontal line, mines at edges, minesweeper tests:6:horizontal line, minesweeper tests:5:space surrounded by mines, minesweeper tests:4:mine surrounded by spaces, minesweeper tests:3:minefield with only mines, minesweeper tests:2:no mines.
2025-10-08T18:45:47+00:00 LEAD#03 I: Test minesweeper tests:2:no mines is successful.
2025-10-08T18:45:47+00:00 LEAD#05 I: Test minesweeper tests:4:mine surrounded by spaces is successful.
2025-10-08T18:45:47+00:00 LEAD#00 I: 8 tests running: minesweeper tests:10:cross, minesweeper tests:9:vertical line, mines at edges, minesweeper tests:7:horizontal line, mines at edges, minesweeper tests:6:horizontal line, minesweeper tests:5:space surrounded by mines, minesweeper tests:4:mine surrounded by spaces, minesweeper tests:3:minefield with only mines, minesweeper tests:2:no mines.
2025-10-08T18:45:47+00:00 LEAD#03 I: End test minesweeper tests:2:no mines.
2025-10-08T18:45:47+00:00 LEAD#04 I: Test minesweeper tests:3:minefield with only mines is successful.
2025-10-08T18:45:47+00:00 LEAD#05 I: End test minesweeper tests:4:mine surrounded by spaces.
2025-10-08T18:45:47+00:00 LEAD#00 I: 8 tests running: minesweeper tests:10:cross, minesweeper tests:9:vertical line, mines at edges, minesweeper tests:7:horizontal line, mines at edges, minesweeper tests:6:horizontal line, minesweeper tests:5:space surrounded by mines, minesweeper tests:4:mine surrounded by spaces, minesweeper tests:3:minefield with only mines, minesweeper tests:2:no mines.
2025-10-08T18:45:47+00:00 LEAD#04 I: End test minesweeper tests:3:minefield with only mines.
2025-10-08T18:45:47+00:00 LEAD#06 I: Test minesweeper tests:5:space surrounded by mines is successful.
2025-10-08T18:45:47+00:00 LEAD#07 I: Test minesweeper tests:6:horizontal line is successful.
2025-10-08T18:45:47+00:00 LEAD#08 I: Test minesweeper tests:7:horizontal line, mines at edges is successful.
2025-10-08T18:45:47+00:00 LEAD#01 I: Test minesweeper tests:9:vertical line, mines at edges is successful.
2025-10-08T18:45:47+00:00 LEAD#02 I: Test minesweeper tests:10:cross is successful.
2025-10-08T18:45:47+00:00 LEAD#00 I: Still 7 tests running : minesweeper tests:11:large minefield, minesweeper tests:10:cross, minesweeper tests:9:vertical line, mines at edges, minesweeper tests:7:horizontal line, mines at edges, minesweeper tests:6:horizontal line, minesweeper tests:5:space surrounded by mines, minesweeper tests:3:minefield with only mines.
2025-10-08T18:45:47+00:00 LEAD#00 I: 7 tests running: minesweeper tests:11:large minefield, minesweeper tests:10:cross, minesweeper tests:9:vertical line, mines at edges, minesweeper tests:7:horizontal line, mines at edges, minesweeper tests:6:horizontal line, minesweeper tests:5:space surrounded by mines, minesweeper tests:3:minefield with only mines.
2025-10-08T18:45:47+00:00 LEAD#06 I: End test minesweeper tests:5:space surrounded by mines.
2025-10-08T18:45:47+00:00 LEAD#07 I: End test minesweeper tests:6:horizontal line.
2025-10-08T18:45:47+00:00 LEAD#08 I: End test minesweeper tests:7:horizontal line, mines at edges.
2025-10-08T18:45:47+00:00 LEAD#01 I: End test minesweeper tests:9:vertical line, mines at edges.
2025-10-08T18:45:47+00:00 LEAD#02 I: End test minesweeper tests:10:cross.
2025-10-08T18:45:47+00:00 LEAD#05 I: Start test minesweeper tests:11:large minefield.
2025-10-08T18:45:47+00:00 LEAD#00 I: Still 6 tests running : minesweeper tests:11:large minefield, minesweeper tests:10:cross, minesweeper tests:9:vertical line, mines at edges, minesweeper tests:7:horizontal line, mines at edges, minesweeper tests:6:horizontal line, minesweeper tests:5:space surrounded by mines.
2025-10-08T18:45:47+00:00 LEAD#00 I: 6 tests running: minesweeper tests:11:large minefield, minesweeper tests:10:cross, minesweeper tests:9:vertical line, mines at edges, minesweeper tests:7:horizontal line, mines at edges, minesweeper tests:6:horizontal line, minesweeper tests:5:space surrounded by mines.
2025-10-08T18:45:47+00:00 LEAD#00 I: Still 1 tests running : minesweeper tests:11:large minefield.
2025-10-08T18:45:47+00:00 LEAD#00 I: 1 tests running: minesweeper tests:11:large minefield.
2025-10-08T18:45:47+00:00 LEAD#05 I: Test minesweeper tests:11:large minefield is successful.
2025-10-08T18:45:47+00:00 LEAD#00 I: Still 1 tests running : minesweeper tests:11:large minefield.
2025-10-08T18:45:47+00:00 LEAD#00 I: 1 tests running: minesweeper tests:11:large minefield.
2025-10-08T18:45:47+00:00 LEAD#05 I: End test minesweeper tests:11:large minefield.
2025-10-08T18:45:47+00:00 LEAD#00 I: Still 1 tests running : minesweeper tests:11:large minefield.
2025-10-08T18:45:47+00:00 LEAD#00 I: 1 tests running: minesweeper tests:11:large minefield.
2025-10-08T18:45:47+00:00 LEAD#00 I: 0 tests running: .
2025-10-08T18:45:47+00:00 LEAD#00 I: Worker LEAD#03 has ended.
2025-10-08T18:45:48+00:00 LEAD#00 I: Worker LEAD#04 has ended.
2025-10-08T18:45:48+00:00 LEAD#00 I: Worker LEAD#06 has ended.
2025-10-08T18:45:48+00:00 LEAD#00 I: Worker LEAD#07 has ended.
2025-10-08T18:45:48+00:00 LEAD#00 I: Worker LEAD#08 has ended.
2025-10-08T18:45:48+00:00 LEAD#00 I: Worker LEAD#01 has ended.
2025-10-08T18:45:48+00:00 LEAD#00 I: Worker LEAD#02 has ended.
2025-10-08T18:45:48+00:00 LEAD#00 I: Worker LEAD#05 has ended.
2025-10-08T18:45:48+00:00 LEAD#00 I: Used 8 worker during test execution.
2025-10-08T18:45:48+00:00 LEAD#00 I: Run 2 tests with shard LEAD#01.
2025-10-08T18:45:48+00:00 LEAD#00 I: Run 1 tests with shard LEAD#08.
2025-10-08T18:45:48+00:00 LEAD#00 I: Run 3 tests with shard LEAD#02.
2025-10-08T18:45:48+00:00 LEAD#00 I: Run 1 tests with shard LEAD#06.
2025-10-08T18:45:48+00:00 LEAD#00 I: Run 2 tests with shard LEAD#05.
2025-10-08T18:45:48+00:00 LEAD#00 I: Run 1 tests with shard LEAD#03.
2025-10-08T18:45:48+00:00 LEAD#00 I: Run 1 tests with shard LEAD#07.
2025-10-08T18:45:48+00:00 LEAD#00 I: Run 1 tests with shard LEAD#04.
2025-10-08T18:45:48+00:00 LEAD#00 I: Check health of shard LEAD#01, 4 times.
2025-10-08T18:45:48+00:00 LEAD#00 I: Check health of shard LEAD#08, 4 times.
2025-10-08T18:45:48+00:00 LEAD#00 I: Check health of shard LEAD#02, 4 times.
2025-10-08T18:45:48+00:00 LEAD#00 I: Check health of shard LEAD#06, 4 times.
2025-10-08T18:45:48+00:00 LEAD#00 I: Check health of shard LEAD#05, 1 times.
2025-10-08T18:45:48+00:00 LEAD#00 I: Check health of shard LEAD#03, 6 times.
2025-10-08T18:45:48+00:00 LEAD#00 I: Check health of shard LEAD#07, 4 times.
2025-10-08T18:45:48+00:00 LEAD#00 I: Check health of shard LEAD#04, 5 times.
2025-10-08T18:45:48+00:00 LEAD#00 I: ==============
2025-10-08T18:45:48+00:00 LEAD#00 I: Summary:
2025-10-08T18:45:48+00:00 LEAD#00 I: Test minesweeper tests:11:large minefield is successful.
2025-10-08T18:45:48+00:00 LEAD#00 I: Test minesweeper tests:10:cross is successful.
2025-10-08T18:45:48+00:00 LEAD#00 I: Test minesweeper tests:9:vertical line, mines at edges is successful.
2025-10-08T18:45:48+00:00 LEAD#00 I: Test minesweeper tests:7:horizontal line, mines at edges is successful.
2025-10-08T18:45:48+00:00 LEAD#00 I: Test minesweeper tests:6:horizontal line is successful.
2025-10-08T18:45:48+00:00 LEAD#00 I: Test minesweeper tests:5:space surrounded by mines is successful.
2025-10-08T18:45:48+00:00 LEAD#00 I: Test minesweeper tests:3:minefield with only mines is successful.
2025-10-08T18:45:48+00:00 LEAD#00 I: Test minesweeper tests:4:mine surrounded by spaces is successful.
2025-10-08T18:45:48+00:00 LEAD#00 I: Test minesweeper tests:2:no mines is successful.
2025-10-08T18:45:48+00:00 LEAD#00 I: Test minesweeper tests:8:vertical line is successful.
2025-10-08T18:45:48+00:00 LEAD#00 I: Test minesweeper tests:0:no rows is successful.
2025-10-08T18:45:48+00:00 LEAD#00 I: Test minesweeper tests:1:no columns is successful.
2025-10-08T18:45:48+00:00 LEAD#00 I: Ran: 12 tests in: 0.12 seconds.
2025-10-08T18:45:48+00:00 LEAD#00 I: Cases: 12.
2025-10-08T18:45:48+00:00 LEAD#00 I: Tried: 12.
2025-10-08T18:45:48+00:00 LEAD#00 I: Errors: 0.
2025-10-08T18:45:48+00:00 LEAD#00 I: Failures: 0.
2025-10-08T18:45:48+00:00 LEAD#00 I: Skip: 0.
2025-10-08T18:45:48+00:00 LEAD#00 I: Todo: 0.
2025-10-08T18:45:48+00:00 LEAD#00 I: Timeout: 0.
